manufacturer_code,manufacturer_name,item_muc,item_name,item_description,item_pack_size,item_category,retailer_code,retailer_name,retailer_category,retailer_city,retailer_address,distributor_code,dist_address,dc_code,dc_name,dc_address,city_name,total_cases,date
606,Britannia Industries Ltd.,60001,Britannia Good Day Biscuits,"Britannia Good Day butter cookies, with a rich and buttery taste, perfect with tea or coffee",75 g,Snacks,,,,,,,,,,,,72,2024-02-29
601,Hindustan Unilever Ltd.,10010,Rin Detergent,"Rin detergent powder, brightens clothes and removes tough stains effectively",1 kg,Home Care,,,,,,,,,,,,30,2024-02-29
609,Marico Ltd.,90006,Veggie Clean,"Veggie Clean vegetable wash, removes pesticides and germs from fruits and vegetables",200 ml,Home Care,,,,,,,,,,,,56,2024-02-29
605,Patanjali Ayurved Ltd.,50010,Patanjali Chyawanprash,"Patanjali Chyawanprash, with Ayurvedic herbs for immunity and strength, suitable for all ages",1 kg,Healthcare,,,,,,,,,,,,24,2024-02-29
609,Marico Ltd.,90003,Set Wet Hair Gel,"Set Wet hair gel, for a wet and stylish look with long-lasting hold and shine",100 ml,Personal Care,,,,,,,,,,,,41,2024-02-29
605,Patanjali Ayurved Ltd.,50003,Patanjali Kesh Kanti Shampoo,"Patanjali Kesh Kanti natural hair cleanser, with herbal extracts for healthy and shiny hair",200 ml,Personal Care,,,,,,,,,,,,49,2024-02-29
603,Nestle India Ltd.,30005,Cerelac Baby Cereal,"Cerelac infant cereal stage 1, fortified with iron and essential vitamins for healthy growth",300 g,Baby Care,,,,,,,,,,,,33,2024-02-29
605,Patanjali Ayurved Ltd.,50002,Patanjali Aloe Vera Gel,"Patanjali Aloe Vera gel, natural skin moisturizer and healer for all skin types",150 ml,Personal Care,,,,,,,,,,,,52,2024-02-29
607,Colgate-Palmolive (India) Ltd.,70006,Vivel Soap,"Vivel luxury creme soap, with almond oil and butter for soft and smooth skin",100 g,Personal Care,,,,,,,,,,,,16,2024-02-29
603,Nestle India Ltd.,30007,Milkmaid Condensed Milk,"Milkmaid sweetened condensed milk, makes delicious desserts and sweets",400 g,Food Products,,,,,,,,,,,,4,2024-02-29
604,Dabur India Ltd.,40008,Fem Bleach,"Fem herbal bleach, with natural ingredients that lighten facial hair without harming the skin",30 g,Personal Care,,,,,,,,,,,,33,2024-02-29
610,Godrej Consumer Products Ltd.,100006,Godrej Nupur Henna,"Godrej Nupur henna, with 9 herbs for natural color and care for your hair",400 g,Personal Care,,,,,,,,,,,,13,2024-02-29
602,Procter & Gamble Hygiene and Health Care Ltd.,20007,Pantene Shampoo,"Pantene hair fall control shampoo, strengthens hair from root to tip and reduces hair fall",340 ml,Personal Care,,,,,,,,,,,,35,2024-02-29
610,Godrej Consumer Products Ltd.,100003,Cinthol Soap,"Cinthol original soap, with refreshing and deodorizing properties, for an active lifestyle",100 g,Personal Care,,,,,,,,,,,,12,2024-02-29
604,Dabur India Ltd.,40002,Dabur Chyawanprash,"Dabur Chyawanprash, enriched with Ayurvedic herbs for immunity and strength",1 kg,Healthcare,,,,,,,,,,,,98,2024-02-29
604,Dabur India Ltd.,40010,Dabur Lal Tail,"Dabur Lal Tail, Ayurvedic massage oil for baby's overall growth and development",500 ml,Baby Care,,,,,,,,,,,,65,2024-02-29
610,Godrej Consumer Products Ltd.,100007,Ezee Liquid Detergent,"Ezee liquid detergent, for gentle and effective washing of delicate fabrics",1 L,Home Care,,,,,,,,,,,,29,2024-02-29
604,Dabur India Ltd.,40009,Odopic Dishwashing Liquid,"Dabur Odopic dishwashing liquid, cuts through grease and leaves dishes sparkling clean",500 ml,Home Care,,,,,,,,,,,,27,2024-02-29
602,Procter & Gamble Hygiene and Health Care Ltd.,20003,Head & Shoulders Shampoo,"Head & Shoulders anti-dandruff shampoo, with menthol for a cooling sensation and healthy scalp",375 ml,Personal Care,,,,,,,,,,,,29,2024-02-29
602,Procter & Gamble Hygiene and Health Care Ltd.,20005,Gillette Razor,"Gillette Mach3 razor, with 3 blades for a close and comfortable shave",1 count,Personal Care,,,,,,,,,,,,11,2024-02-29
608,ITC Ltd.,80009,Dermafique Face Serum,"Dermafique serum, with advanced skincare technology for youthful and radiant skin",30 ml,Personal Care,,,,,,,,,,,,5,2024-02-29
607,Colgate-Palmolive (India) Ltd.,70008,Colgate Mouthwash,"Colgate Plax mouthwash, with antibacterial properties for long-lasting fresh breath",250 ml,Personal Care,,,,,,,,,,,,77,2024-02-29
605,Patanjali Ayurved Ltd.,50006,Patanjali Amla Juice,"Patanjali Amla juice, rich in Vitamin C and antioxidants for overall health and immunity",1 L,Beverages,,,,,,,,,,,,4,2024-02-29
606,Britannia Industries Ltd.,60009,Britannia Milk,"Britannia toned milk, enriched with essential nutrients for a healthy lifestyle",1 L,Beverages,,,,,,,,,,,,80,2024-02-29
602,Procter & Gamble Hygiene and Health Care Ltd.,20006,Olay Moisturizer,"Olay total effects 7-in-1 anti-ageing moisturizer, fights the 7 signs of ageing for younger-looking skin",50 g,Personal Care,,,,,,,,,,,,75,2024-02-29
606,Britannia Industries Ltd.,60006,Britannia Milk Bikis Biscuits,"Britannia Milk Bikis biscuits, enriched with the goodness of milk, a favorite among kids",100 g,Snacks,,,,,,,,,,,,64,2024-02-29
605,Patanjali Ayurved Ltd.,50004,Patanjali Honey,"Patanjali honey, pure and natural honey sourced from Himalayan forests",500 g,Food Products,,,,,,,,,,,,74,2024-02-29
610,Godrej Consumer Products Ltd.,100005,Godrej Aer Air Freshener,"Godrej Aer click air freshener, with a fragrance that lasts up to 60 days",10 g,Home Care,,,,,,,,,,,,17,2024-02-29
603,Nestle India Ltd.,30003,Nescafe Coffee,"Nescafe classic coffee, made from medium-dark roasted coffee beans for a rich aroma and smooth taste",50 g,Beverages,,,,,,,,,,,,38,2024-02-29
606,Britannia Industries Ltd.,60005,Britannia Rusk,"Britannia rusk, crunchy and delicious, perfect for dipping in tea or coffee",273 g,Snacks,,,,,,,,,,,,53,2024-02-29
601,Hindustan Unilever Ltd.,10003,Knorr Soup,Knorr classic thick tomato soup with a delightful taste of tomatoes and real vegetables,53 g,Food Products,,,,,,,,,,,,37,2024-02-29
603,Nestle India Ltd.,30004,Everyday Dairy Whitener,"Everyday dairy whitener, adds a rich and creamy taste to your tea and coffee",200 g,Beverages,,,,,,,,,,,,34,2024-02-29
604,Dabur India Ltd.,40003,Dabur Amla Hair Oil,"Dabur Amla hair oil, with the goodness of amla for strong, healthy hair",200 ml,Personal Care,,,,,,,,,,,,34,2024-02-29
607,Colgate-Palmolive (India) Ltd.,70007,Cibaca Toothbrush,"Cibaca toothbrush, with soft bristles for effective cleaning and gentle on gums",1 count,Personal Care,,,,,,,,,,,,99,2024-02-29
609,Marico Ltd.,90008,Livon Hair Serum,"Livon hair serum, with vitamin E for instant shine and frizz-free hair",100 ml,Personal Care,,,,,,,,,,,,75,2024-02-29
607,Colgate-Palmolive (India) Ltd.,70005,Hills Biscuits,"Hills cream biscuits, rich and creamy biscuits, a delightful treat for any time of the day",100 g,Snacks,,,,,,,,,,,,45,2024-02-29
605,Patanjali Ayurved Ltd.,50001,Patanjali Dant Kanti Toothpaste,"Patanjali Dant Kanti toothpaste, herbal formulation for strong gums and teeth",200 g,Personal Care,,,,,,,,,,,,60,2024-02-29
602,Procter & Gamble Hygiene and Health Care Ltd.,20004,Whisper Sanitary Pads,"Whisper ultra soft sanitary pads, with 1000 suction holes for clean, dry protection",Regular,Feminine Hygiene,,,,,,,,,,,,65,2024-02-29
603,Nestle India Ltd.,30010,Bar-One Chocolate,"Nestle Bar-One chocolate bar, with crunchy wafer and rich chocolate for an energy boost",19 g,Snacks,,,,,,,,,,,,46,2024-02-29
601,Hindustan Unilever Ltd.,10006,Tresemme Shampoo,"Tresemme keratin smooth shampoo with argan oil, helps control frizz and makes hair smooth and shiny",185 ml,Personal Care,,,,,,,,,,,,90,2024-02-29
607,Colgate-Palmolive (India) Ltd.,70004,Axion Dishwashing Paste,"Axion dishwashing paste, cuts through grease and leaves dishes sparkling clean",400 g,Home Care,,,,,,,,,,,,94,2024-02-29
605,Patanjali Ayurved Ltd.,50005,Patanjali Badam Pak,"Patanjali Badam Pak, nutritious supplement with almonds for strength and energy",500 g,Healthcare,,,,,,,,,,,,25,2024-02-29
606,Britannia Industries Ltd.,60003,Britannia Bourbon Chocolate,"Britannia Bourbon chocolate cream biscuits, rich chocolate cream between crispy biscuits",150 g,Snacks,,,,,,,,,,,,6,2024-02-29
608,ITC Ltd.,80001,Sunfeast Yippee Noodles,"Sunfeast Yippee noodles, with the goodness of wheat and delicious masala taste",75 g,Food Products,,,,,,,,,,,,53,2024-02-29
606,Britannia Industries Ltd.,60008,Britannia Cheese,"Britannia cheese slice, made from pure milk for a rich and creamy taste, perfect for sandwiches",200 g,Food Products,,,,,,,,,,,,62,2024-02-29
609,Marico Ltd.,90001,Parachute Coconut Oil,"Parachute pure coconut hair oil, with the goodness of coconut for strong and healthy hair",500 ml,Personal Care,,,,,,,,,,,,23,2024-02-29
610,Godrej Consumer Products Ltd.,100001,Godrej No.1 Soap,"Godrej No.1 sandal and turmeric soap, enriched with natural oils for soft and glowing skin",100 g,Personal Care,,,,,,,,,,,,65,2024-02-29
601,Hindustan Unilever Ltd.,10004,Lipton Green Tea,"Lipton pure and light green tea leaves, for a refreshing and healthy drink",100 g,Beverages,,,,,,,,,,,,33,2024-02-29
606,Britannia Industries Ltd.,60002,Britannia Marie Gold Biscuits,"Britannia Marie Gold biscuits, light and crunchy biscuits, a perfect tea-time snack",120 g,Snacks,,,,,,,,,,,,85,2024-02-29
602,Procter & Gamble Hygiene and Health Care Ltd.,20002,Ariel Detergent,"Ariel Matic front load detergent powder, removes tough stains and keeps clothes bright",1 kg,Home Care,,,,,,,,,,,,96,2024-02-29
605,Patanjali Ayurved Ltd.,50009,Patanjali Oats,"Patanjali oats, nutritious and healthy option for breakfast, rich in fiber and essential nutrients",500 g,Food Products,,,,,,,,,,,,98,2024-02-29
608,ITC Ltd.,80003,Fiama Di Wills Soap,"Fiama Di Wills gel bar soap, with skin conditioners for soft and glowing skin",125 g,Personal Care,,,,,,,,,,,,96,2024-02-29
601,Hindustan Unilever Ltd.,10005,Pears Soap,Pears pure and gentle soap with natural oils and glycerin for soft and moisturized skin,125 g,Personal Care,,,,,,,,,,,,79,2024-02-29
610,Godrej Consumer Products Ltd.,100009,Godrej Shikakai Shampoo,"Godrej Shikakai shampoo, with natural extracts of shikakai for clean and healthy hair",200 ml,Personal Care,,,,,,,,,,,,24,2024-02-29
601,Hindustan Unilever Ltd.,10008,Closeup Toothpaste,"Closeup deep action toothpaste, with active zinc mouthwash for long-lasting fresh breath and strong teeth",150 g,Personal Care,,,,,,,,,,,,8,2024-02-29
603,Nestle India Ltd.,30006,Munch Chocolate,"Nestle Munch chocolate bar, with crunchy caramel and rich chocolate, a perfect snack",32 g,Snacks,,,,,,,,,,,,20,2024-02-29
602,Procter & Gamble Hygiene and Health Care Ltd.,20009,Oral-B Toothbrush,"Oral-B cross action toothbrush, with angled bristles to reach deep between teeth",1 count,Personal Care,,,,,,,,,,,,94,2024-02-29
609,Marico Ltd.,90009,Set Wet Deodorant,"Set Wet cool deodorant, with a fresh and cool fragrance for all-day freshness",150 ml,Personal Care,,,,,,,,,,,,1,2024-02-29
608,ITC Ltd.,80006,Savlon Antiseptic Liquid,"Savlon antiseptic liquid, with powerful germ protection for minor cuts and wounds",500 ml,Healthcare,,,,,,,,,,,,81,2024-02-29
608,ITC Ltd.,80002,Classmate Notebook,"Classmate 200 pages single line notebook, ideal for school and college students",200 pages,Stationery,,,,,,,,,,,,80,2024-02-29
603,Nestle India Ltd.,30008,Maggi Ketchup,"Maggi hot and sweet tomato ketchup, adds a tangy twist to your snacks and meals",500 g,Food Products,,,,,,,,,,,,71,2024-02-29
609,Marico Ltd.,90004,Mediker Shampoo,"Mediker anti-lice shampoo, with neem and coconut extracts for effective lice removal",200 ml,Personal Care,,,,,,,,,,,,78,2024-02-29
604,Dabur India Ltd.,40001,Dabur Honey,"Dabur honey, 100% pure and natural honey for daily health and nutrition",500 g,Food Products,,,,,,,,,,,,35,2024-02-29
606,Britannia Industries Ltd.,60010,Britannia Ghee,"Britannia cow ghee, made from pure cow's milk for a rich and authentic flavor",500 g,Food Products,,,,,,,,,,,,3,2024-02-29
603,Nestle India Ltd.,30001,Maggi Noodles,"Maggi instant noodles, ready in just 2 minutes, with a delicious taste of spices and vegetables",70 g,Food Products,,,,,,,,,,,,98,2024-02-29
608,ITC Ltd.,80007,Sunfeast Dark Fantasy Chocolate,"Sunfeast Dark Fantasy choco fills cookies, with a rich chocolatey filling inside",75 g,Snacks,,,,,,,,,,,,72,2024-02-29
606,Britannia Industries Ltd.,60007,Britannia NutriChoice Digestive Biscuits,"Britannia NutriChoice digestive biscuits, with the goodness of whole wheat and fiber",250 g,Snacks,,,,,,,,,,,,52,2024-02-29
602,Procter & Gamble Hygiene and Health Care Ltd.,20010,Old Spice Deodorant,"Old Spice original deodorant spray, with a fresh and masculine fragrance",150 ml,Personal Care,,,,,,,,,,,,22,2024-02-29
